{
  "$schema": "../../../../schemas/unity-build-config.schema.json",
  "projectName": "example-project",
  "companyName": "ExampleCompany",
  "productName": "ExampleProject",
  "bundleVersion": "1.0.0",
  "buildNumberStrategy": "github_run_number",
  "outputDirectory": "Builds",
  "scenes": [
    "Assets/Scenes/Bootstrap.unity",
    "Assets/Scenes/MainMenu.unity",
    "Assets/Scenes/Level01.unity"
  ],
  "scriptingBackend": "IL2CPP",
  "apiCompatibilityLevel": "NET_Standard_2_1",
  "developmentBuild": false,
  "allowDebugging": false,
  "runTests": true,
  "android": {
    "applicationId": "com.example.project",
    "buildAppBundle": true,
    "minSdkVersion": 22,
    "targetSdkVersion": 34,
    "architecture": "ARM64",
    "keystoreMode": "custom"
  },
  "gates": {
    "maxBuildSizeMB": 300,
    "warnBuildSizeIncreasePct": 5,
    "failBuildSizeIncreasePct": 15
  },
  "metadata": {
    "repo": "example-project"
  }
}
